{
  "$schema": "https://json-schema.org/draft/2020-12/schema",
  "bundle-size": {
    "enabled": true,
    "path": "dist/index.mjs",
    "compression": "gzip"
  },
  "fps": { "enabled": false, "reason": "package has no runtime canvas" },
  "bench": { "enabled": false, "reason": "no perf-critical surface in this package" },
  "gate": { "enabled": false, "reason": "covered by repo-root gates" },
  "spike-report": { "enabled": false, "reason": "not a spike package" }
}
